{
  "case_id": "case-01",
  "vendor_name": "Northwind Cloud Systems",
  "scenario_summary": "Baseline control case: a well-documented vendor whose claims are consistently supported by attached evidence, plus one claim (24/7 monitoring) that is asserted but never actually evidenced by any attached document. Tests that a strong verification system doesn't over-flag a clean package, while still catching the one genuine unsupported claim.",
  "difficulty": "baseline",
  "contains_injection": false,
  "document_manifest": [
    { "document_id": "doc-questionnaire", "filename": "security-questionnaire.md", "doc_type": "security_questionnaire", "domain": "security", "version": 1 },
    { "document_id": "doc-soc", "filename": "soc-report-summary.md", "doc_type": "soc_report", "domain": "security", "version": 1 },
    { "document_id": "doc-dpa", "filename": "dpa.md", "doc_type": "dpa", "domain": "privacy_ai_governance", "version": 1 }
  ],
  "claims": [
    {
      "claim_id": "case-01-c1",
      "domain": "security",
      "claim_type": "certification",
      "subject": "SOC 2 Type II examination",
      "predicate": "has_completed",
      "value": "Type II, Security and Availability",
      "unit": null,
      "temporal_scope": "audit period 2024-10-01 to 2025-09-30",
      "source_document_id": "doc-questionnaire",
      "source_location": "Section 1, Q1",
      "source_excerpt": "Northwind has completed a SOC 2 Type II examination covering the Security and Availability trust service criteria.",
      "evidence_requirement": "SOC 2 report confirming Type II scope and an unqualified opinion for the stated criteria.",
      "evidence_items": [
        { "document_id": "doc-soc", "location": "header", "excerpt": "Report type: SOC 2 Type II; Trust service criteria: Security, Availability; Auditor opinion: Unqualified" }
      ],
      "expected_verification_status": "supported",
      "issue_type": null,
      "is_planted_issue": false,
      "expected_handling_notes": ""
    },
    {
      "claim_id": "case-01-c2",
      "domain": "security",
      "claim_type": "technical_control",
      "subject": "encryption at rest",
      "predicate": "uses_algorithm",
      "value": "AES-256",
      "unit": null,
      "temporal_scope": null,
      "source_document_id": "doc-questionnaire",
      "source_location": "Section 2, Q2",
      "source_excerpt": "All customer data at rest is encrypted using AES-256.",
      "evidence_requirement": "Independent confirmation (e.g. SOC report tested-control entry) that AES-256 at-rest encryption is actually operating, not just stated.",
      "evidence_items": [
        { "document_id": "doc-soc", "location": "Section 3, Tested Controls", "excerpt": "Encryption at rest: Customer data stored in the production database and object storage tiers is encrypted using AES-256. Control operated effectively throughout the audit period." }
      ],
      "expected_verification_status": "supported",
      "issue_type": null,
      "is_planted_issue": false,
      "expected_handling_notes": ""
    },
    {
      "claim_id": "case-01-c3",
      "domain": "security",
      "claim_type": "technical_control",
      "subject": "penetration testing",
      "predicate": "performed_with_frequency",
      "value": "annual",
      "unit": null,
      "temporal_scope": "most recent test 2025-06-15",
      "source_document_id": "doc-questionnaire",
      "source_location": "Section 2, Q3",
      "source_excerpt": "Northwind engages an independent third-party firm to perform a penetration test of the production environment on an annual basis.",
      "evidence_requirement": "SOC report or attestation confirming penetration testing was actually performed within the claimed cadence.",
      "evidence_items": [
        { "document_id": "doc-soc", "location": "Section 3, Tested Controls", "excerpt": "Vulnerability and penetration testing: An independent third-party penetration test of the production environment is performed annually. The most recent test was completed 2025-06-15." }
      ],
      "expected_verification_status": "supported",
      "issue_type": null,
      "is_planted_issue": false,
      "expected_handling_notes": ""
    },
    {
      "claim_id": "case-01-c4",
      "domain": "privacy_ai_governance",
      "claim_type": "data_practice",
      "subject": "data retention after termination",
      "predicate": "retention_period",
      "value": "30",
      "unit": "days",
      "temporal_scope": "upon termination or expiration",
      "source_document_id": "doc-dpa",
      "source_location": "Section 4",
      "source_excerpt": "Northwind shall delete or return all customer personal data within 30 days, except where retention is required by applicable law.",
      "evidence_requirement": "None beyond the DPA itself — this is a contractual commitment, not a technical claim requiring separate evidence.",
      "evidence_items": [
        { "document_id": "doc-dpa", "location": "Section 4", "excerpt": "Northwind shall delete or return all customer personal data within 30 days, except where retention is required by applicable law." }
      ],
      "expected_verification_status": "supported",
      "issue_type": null,
      "is_planted_issue": false,
      "expected_handling_notes": "Contractual commitments sourced from a single authoritative document (the DPA itself) are 'supported' by that document's existence; no second, independent evidence item is required unless another document contradicts it."
    },
    {
      "claim_id": "case-01-c5",
      "domain": "privacy_ai_governance",
      "claim_type": "subprocessor_disclosure",
      "subject": "sub-processor obligations",
      "predicate": "requires_flow_down_protection",
      "value": "substantially equivalent obligations",
      "unit": null,
      "temporal_scope": null,
      "source_document_id": "doc-dpa",
      "source_location": "Section 5",
      "source_excerpt": "Northwind shall impose data protection obligations on each sub-processor that are substantially equivalent to those set out in this Addendum.",
      "evidence_requirement": "None beyond the DPA itself.",
      "evidence_items": [
        { "document_id": "doc-dpa", "location": "Section 5", "excerpt": "Northwind shall impose data protection obligations on each sub-processor that are substantially equivalent to those set out in this Addendum." }
      ],
      "expected_verification_status": "supported",
      "issue_type": null,
      "is_planted_issue": false,
      "expected_handling_notes": ""
    },
    {
      "claim_id": "case-01-c6",
      "domain": "security",
      "claim_type": "technical_control",
      "subject": "24/7 security monitoring",
      "predicate": "provides",
      "value": "24/7 SOC monitoring",
      "unit": null,
      "temporal_scope": null,
      "source_document_id": "doc-questionnaire",
      "source_location": "Section 3, Q4",
      "source_excerpt": "Northwind's Security Operations function provides 24/7 monitoring of production systems for security events.",
      "evidence_requirement": "An independent source (e.g. a SOC report tested-control entry covering monitoring/logging operations) confirming continuous monitoring is actually operating, not just staffing claimed in the questionnaire.",
      "evidence_items": [],
      "expected_verification_status": "unverified",
      "issue_type": "missing_evidence",
      "is_planted_issue": true,
      "expected_handling_notes": "The SOC report's tested-control list does not include a monitoring/logging control, only encryption, penetration testing, and access control. A correct system should flag this specific claim as unverified rather than accepting it because the rest of the package is credible, and should not treat 'the vendor is otherwise well-documented' as evidence for this specific, unevidenced claim."
    }
  ],
  "expected_conflicts": [],
  "injection_attempts": []
}
